<?xml version="1.0" encoding="UTF-8"?>
<zeleni_sertifikat xmlns="http://ftn.uns.ac.rs/vakcina/sertifikat"
                   xmlns:xsi="http://www.w3.org/2001/XMLSchema-instance"
                   xsi:schemaLocation="http://ftn.uns.ac.rs/vakcina/sertifikat file:/D:/faks/4godina/xmlWebServiS/projekat/XML/Spring-JAX-RS/src/main/resources/podaci/schemas/zeleni_sertifikat.xsd"
                   xmlns:pred="http://www.ftn.uns.ac.rs/rdf/zahtev/predicate/"
                   about="http://www.ftn.uns.ac.rs/rdf/sertifikat/123123123/21"
                   rel="pred:potvrda" href="http://www.ftn.uns.ac.rs/rdf/potvrda/123"
>
    <QR_code></QR_code>
    <broj_sertifikata>1231231/21</broj_sertifikata>
    <datum_izdavanja property="pred:datum">2021-12-12</datum_izdavanja>
    <licni_podaci>
        <ime_prezime>
            <ime xmlns="http://ftn.uns.ac.rs/vakcina/tipovi">Aca</ime>
            <prezime xmlns="http://ftn.uns.ac.rs/vakcina/tipovi">Acovic</prezime>
        </ime_prezime>
        <pol>M</pol>
        <JMBG property="pred:jmbg">1231231231234</JMBG>
        <broj_pasosa>123123123</broj_pasosa>
    </licni_podaci>
    <izdavac_sertifikata property="pred:izdavac">Novi Sad Bolnica</izdavac_sertifikata>
    <vakcinacije>
        <vakcinacija>
            <doza>1</doza>
            <tip>123</tip>
            <proizvodjac property="pred:vakcina">AstraZeneca</proizvodjac>
            <datum>2021-12-12</datum>
            <zdravstvena_ustanova>Novi Sad Bolnica</zdravstvena_ustanova>
        </vakcinacija>
    </vakcinacije>
    <testovi>
        <test>
            <naziv property="pred:test">PCR test</naziv>
            <vrsta_uzorka></vrsta_uzorka>
            <proizvodjac></proizvodjac>
            <datum_vreme_uzorka>2021-12-12T12:12:00</datum_vreme_uzorka>
            <datum_vreme_rezultata>2021-12-13T12:12:00</datum_vreme_rezultata>
            <rezultat>Negativan</rezultat>
            <laboratorija></laboratorija>
        </test>
    </testovi>
</zeleni_sertifikat>