<?xml version="1.0" encoding="UTF-8"?>
<zeleni_sertifikat xmlns:xsi="http://www.w3.org/2001/XMLSchema-instance"
    xsi:noNamespaceSchemaLocation="file:/F:/4.%20Godina/XML/XML/schemas/zeleni_sertifikat.xsd">
    <QR_code></QR_code>
    <broj_sertifikata>1785483/21</broj_sertifikata>
    <datum_izdavanja>2021-11-04</datum_izdavanja>
    <licni_podaci>
        <ime_prezime>
            <ime>Aleksandar</ime>
            <prezime>Jovanović</prezime>
        </ime_prezime>
        <pol>Musko</pol>
        <JMBG>0808999742049</JMBG>
        <broj_pasosa>012001139</broj_pasosa>
    </licni_podaci>
    <izdavac_sertifikata>Institute of Public Health of Serbia "Dr Milan Jovanović Batut"</izdavac_sertifikata>
    <vakcinacije>
    
    </vakcinacije>
    <testovi>
       
    </testovi>
    <prelezana>
        <datum_pozitivnog>2021-08-02</datum_pozitivnog>
        <laboratorija>Opšta bolnica Vranje</laboratorija>
    </prelezana>
</zeleni_sertifikat>